{
  "schema_version": "1.0.0",
  "stack_id": "ruby-rails",
  "baseline_id": "ruby-rails-2026-08-05",
  "verified_at": "2026-08-05",
  "effective_at": "2026-08-05",
  "status": "verified",
  "components": {
    "ruby": {
      "latest_stable_patch": "4.0.6",
      "maintenance": {
        "4.0": "normal",
        "3.4": "normal",
        "3.3": "security",
        "3.2": "eol"
      }
    },
    "rails": {
      "current_security_release": "8.1.3.1",
      "current_line": "8.1.x",
      "required_ruby_for_8_1": "3.2.0 or newer",
      "policy": "one year bug fixes and two years security fixes after a minor series starts"
    },
    "bundler": {
      "latest_stable": "4.0.17"
    },
    "puma": {
      "latest_release": "8.0.2"
    },
    "solid_queue": {
      "current_observed_release": "1.5.0",
      "rails_default": "default production Active Job backend from Rails 8.0 onward"
    },
    "audit_principles": [
      "verify exact runtime and process role",
      "do not transfer CRuby semantics to JRuby or TruffleRuby",
      "prove old and new release coexistence",
      "test rollback or forward repair",
      "perform isolated restore"
    ]
  },
  "source_refs": [
    "https://www.ruby-lang.org/en/news/2026/07/14/ruby-4-0-6-released/",
    "https://www.ruby-lang.org/en/downloads/branches/",
    "https://rubyonrails.org/2026/7/29/Rails-Versions-7-2-3-2-8-0-5-1-and-8-1-3-1-have-been-released",
    "https://guides.rubyonrails.org/maintenance_policy.html",
    "https://guides.rubyonrails.org/active_job_basics.html",
    "https://guides.rubyonrails.org/8_0_release_notes.html",
    "https://rubygems.org/gems/rails/versions/8.1.3",
    "https://rubygems.org/gems/bundler/versions/4.0.17",
    "https://puma.io/",
    "https://rubygems.org/gems/solid_queue"
  ]
}
